#term ID	term description	observed gene count	background gene count	strength	false discovery rate	matching proteins in your network (IDs)	matching proteins in your network (labels)
MMU-156827	L13a-mediated translational silencing of Ceruloplasmin expression	5	50	2.06	5.33e-08	10090.ENSMUSP00000003521,10090.ENSMUSP00000006496,10090.ENSMUSP00000054490,10090.ENSMUSP00000103940,10090.ENSMUSP00000115722	Rps11,Rps9,Rps23,Rps16,Rpl13a
MMU-72689	Formation of a pool of free 40S subunits	4	37	2.1	7.66e-07	10090.ENSMUSP00000003521,10090.ENSMUSP00000006496,10090.ENSMUSP00000054490,10090.ENSMUSP00000103940	Rps11,Rps9,Rps23,Rps16
MMU-72695	Formation of the ternary complex, and subsequently, the 43S complex	4	40	2.06	7.69e-07	10090.ENSMUSP00000003521,10090.ENSMUSP00000006496,10090.ENSMUSP00000054490,10090.ENSMUSP00000103940	Rps11,Rps9,Rps23,Rps16
MMU-72649	Translation initiation complex formation	4	48	1.99	1.04e-06	10090.ENSMUSP00000003521,10090.ENSMUSP00000006496,10090.ENSMUSP00000054490,10090.ENSMUSP00000103940	Rps11,Rps9,Rps23,Rps16
MMU-72702	Ribosomal scanning and start codon recognition	4	46	2.0	1.04e-06	10090.ENSMUSP00000003521,10090.ENSMUSP00000006496,10090.ENSMUSP00000054490,10090.ENSMUSP00000103940	Rps11,Rps9,Rps23,Rps16
MMU-6791226	Major pathway of rRNA processing in the nucleolus and cytosol	4	102	1.66	1.09e-05	10090.ENSMUSP00000003521,10090.ENSMUSP00000006496,10090.ENSMUSP00000054490,10090.ENSMUSP00000103940	Rps11,Rps9,Rps23,Rps16
